会社名,ステータス,キャッチコピー
リアルパートナーズ株式会社 | 【横浜・川崎エリア不動産会社ランキング三冠受賞企業】,正社員,100％反響型の【不動産営業】／平均月収57.5万円／20代活躍中 正社員
株式会社エム・シー・ピー | ★基本定時退社★正当評価で年収1000万円も可能★昇給年4回,正社員,★残業なし★最大18連休！メリハリつけて働ける【積算スタッフ】 正社員
株式会社リーガルインフォメーション | ★神戸・名古屋・仙台・大宮での同時募集！★WEB面接可！,正社員,【営業（内勤・外勤）】★賞与平均5ヶ月実績★未経験歓迎！ 正社員
株式会社カワグチ | 名古屋市緑区・刈谷・豊明からもアクセス抜群★有休取得率80%,契約社員,オリジナル商品の【製造補助スタッフ】★未経験歓迎／日勤のみ 契約社員
株式会社エステート白馬 | 南浦和店／不動産・建設・介護等を手掛ける白馬グループの中核,正社員,お客様のマイホーム購入をサポート！【ホームアドバイザー】 正社員
株式会社エヴァ・ライフ | ＼ 高収入が目指せます ／インセンティブが10万円を超える月も?!,正社員,今後の拡大に期待大！【 福祉用具のルート営業 】*新店舗もOPEN 正社員
GTNET株式会社 | 全国の拠点で現地面接・現地採用｜売上64億以上を誇る企業で活躍,正社員,スポーツカーの【メンテナンス】※経験者/即戦力は月給38万以上 正社員
株式会社ファーム・アライアンス・マネジメント | ”農業”に特化◆会社を裏から支える◎年休125日／賞与年2回,正社員,【総務・財務・人事（管理職）】経験を活かしてマルチに活躍！ 正社員
株式会社ツイテルホーム | 選べる働き方→週休3日制も可能♪転勤なく好きな街で働ける,正社員,＼新PJのオープニング／お金を払う営業！不用品の【買取営業】 正社員
ソーシャルインクルー株式会社 | 今期も増収増益を更新◎将来性・安定性ともに業界トップクラス！,正社員,【人事(採用/労務)】未経験・第二新卒歓迎／月給30万円以上 正社員
エスシーエス株式会社 | 《エコ事業に貢献》★面接保証◎TEL問合せ歓迎⇒048-936-1234,正社員,未経験月給29.5万円スタート【ルートドライバー】★基本定時退社 正社員
SE住宅ローンサービス株式会社 | JASDAQ上場エヌ・シー・エヌ100％出資子会社◆年収500万以上OK,正社員,《経験者限定》550以上の顧客リストを活用！【住宅ローン営業】 正社員
有限会社中央物流 | ブランクある方もOK！30代～40代の育児中ドライバー活躍中！,正社員,【 大型トレーラードライバー 】★月給45万円スタート 正社員
株式会社日本シーマート | 旬の駅 大和郡山に新店OPEN/事業拡大のため増員募集/入社祝金有,正社員,【鮮魚調理販売スタッフ】月給26.5万～も可能★賞与年2回 正社員
株式会社サンフジ建設 | 年商90億円以上を誇るグループ企業★直帰直帰可・報奨金あり！,正社員,【施工管理】◎月給65万円以上可能！基本定時退社・賞与年2回 正社員
株式会社三進ろ過工業 | 《福岡限定！博多駅徒歩12分》★未経験でも月給25万円スタート★,正社員,【技術スタッフ(点検・メンテナンス)】★年休128日★未経験OK 正社員
伊豫スズキ販売株式会社 | #業界でも珍しい完全週休2日をいち早く導入#年休126日,正社員,未経験を育成します！チーム制で取り組む【営業スタッフ】 正社員
株式会社バントウ | ＃実力主義の技術者集団＃高収入エンジニアを目指せる[近道]あり,正社員,【ITエンジニア（Kotlin/Java言語など）】＊フルリモートも可 正社員
株式会社誠 | 家具家電付き1R寮完備／独立後に月収60万円超を叶えた先輩も！,正社員,イチから手に職を！【施工スタッフ】月給26万以上／残業ほぼなし 正社員
株式会社ビビット | 【ハウスドゥ川越新河岸】★未経験でも月25万円～ ★完全週休2日,正社員,未経験から年収1000万円可能！【不動産営業】★充実の研修で安心 正社員
BEST株式会社 | 【福岡拠点 NEW OPEN！！】＼＼スターティングメンバ―募集／／,正社員,社員の半数以上が月収45万円超を実現【ライフサービススタッフ】 正社員
株式会社大阪真和エンタープライズ | 総売上122億円以上！安定基盤/面接1回/賞与年2回/福利厚生◎,正社員,【不動産営業】残業17h・完全週休2日で働きやすさ◎転勤なし 正社員
株式会社ネクサス | 2019年に設立！3年目を迎えた新鋭企業！／残業少なめ／転勤なし,正社員,【配送ドライバー】準中型免許でスタートOK！／日帰りのみ！ 正社員
大仲金属株式会社 | (ダイナカキンゾク) ◆完全週休2日/平均月収35万円/未経験歓迎,正社員,星空に近い、自然の中で働く【設備管理スタッフ】 正社員
株式会社有藤商店 | 業績好調／頑張り次第で年収700万円も可能！決算賞与もあり,正社員,人生を明るく！新しい自分に出会える【メンテナンススタッフ】 正社員
UTHP株式会社 | 東証一部上場企業グループ・日立グループへの転籍実績も多数,正社員,未経験でも月収34万円以上可【ものづくりスタッフ】茨城勤務 正社員
株式会社TAKEFUJI | 電話での問い合わせもOK！【045-383-9697】,業務委託,【ドライバー】★履歴書不要！1年目で月収80万円も可能 業務委託
村地綜合木材株式会社 | 応募資格を満たす方は全員面接！過去最高益を更新中の成長企業,正社員,普通免許でOK【配送ドライバー】＊未経験でも月給28万円～ 正社員
大津紙運輸株式会社 | 【大津板紙株式会社の子会社】★資格は会社全額負担で取得OK,正社員,力仕事ほぼなし！将来性抜群の【倉庫管理】※賞与4ヶ月分 正社員
株式会社松本電機製作所 | 三菱電機、オムロン等と取引/【モデル年収】29歳…年収600万円,正社員,【電気工事スタッフ】★年間休日125日＋有給もしっかり取得 正社員
株式会社エイトエンジニアリング | 設立以来、増益増収を継続中／エンジニアファーストを徹底,正社員,【設計エンジニア】※転職者全員が収入アップを実現！ 正社員
株式会社東亜産業 | 賞与年2回（業績により）／20代～30代中心に活躍中！,正社員,NEWオープン！ディスカウントストアの【店長候補】 正社員
株式会社Ｔ．ｖａｌｕｅ | 安定して稼ぐなら「断る理由がない」サービスを。未経験大歓迎！,正社員,★立ち上げメンバー【電力アドバイザ】月給27万円／完全週休2日 正社員
株式会社T.K.R | テレビCMも放映中の安定企業！ノルマ無しの完全反響営業募集◎,正社員,第二新卒歓迎！【コンサル営業】営業未経験でも月給30万円～！ 正社員
株式会社清光社 | 未経験OK/残業月10h以下/夜勤なし/未経験でも多彩なキャリアパス,正社員,"人々の""日常""を支える！【設備管理スタッフ】安定企業で活躍◎ 正社員"
株式会社渡辺ホールディングス | ★自社サービス★土日祝休み★年休124日★毎月2種類の歩合あり,正社員,【マーケティング営業】★未経験OK★月給25万円～★高額歩合あり 正社員
株式会社マツシタホーム | ◆茨城東部地区着工トップクラス◆独自の仕組みプラン契約率80%,正社員,《前職年収以上考慮》住宅メーカーの【アフターメンテナンス】 正社員
株式会社建築資料研究社 | 景気に左右されない！資格系スクール「日建学院」を運営,正社員,★上野校・北千住校募集★【ライセンスアドバイザー】 正社員
"Earth ecology株式会社 | 完全週休2日制！★社用車貸与※転勤なし◇最高年収は1,600万円！",正社員,平均年収500万円超！ エコ商材の【提案営業】 ★年間休日120日 正社員
株式会社KASOL | 【カーソル】★エンジニアの働きやすさ＆成長にこだわる会社★,正社員,【SE/PG】仕事内容・将来ビジョンを社長に直接相談できる(*^-^*) 正社員
株式会社東名 | 2020年7月に東証・名証一部に上場しました！,正社員,【インサイドセールス】月給27万円以上／インセン有／未経験歓迎 正社員
アスモホーム株式会社 | 完全週休2日／年2回の長期休暇／経験者の1年目平均月収35万円,正社員,人気エリア港区の不動産を扱う！【反響営業】☆残業月15時間以内 正社員
株式会社エム・シー・ピー | ★年齢不問★連続休暇取得も可★資格取得支援有★20～50代活躍中,正社員,【マンション修繕の施工管理】年収1000万円も可能/昇給年4回実績 正社員
有限会社イースト・コーポレーション | ～大手ゼネコンと直取引する安定企業～＜条件に合う方全員面接＞,正社員,【施工管理スタッフ】◆残業ほぼナシ◆長期連休もとりやすい！ 正社員
大阪第一交通株式会社 | 上場グループ／年収500万円以上可／大阪府緊急雇用対策に賛同,正社員,業界大手の【タクシードライバー】高収入＆働きやすい職場環境！ 正社員
株式会社小山電機工事 | <Welcome>電気工事の経験者、仕事もプライベートも大事にする方,正社員,『未経験OK』石川で活躍する【電気工事士】★平均年齢31.7歳★ 正社員
株式会社アンフィニ | 【大阪府緊急雇用対策に賛同】＊年間休日110日＊,正社員,早期キャリア＆収入UPも可能な【PRスタッフ】★残業なし 正社員
臨海建設株式会社 | ＼公共案件100％／総合土木業として愛媛に貢献！＜面接1回のみ＞,正社員,初年度年収500万円以上目指せる！【土木施工管理】※転勤なし 正社員
株式会社統源 | 採用担当直通★TEL問い合わせもOK⇒080-3350-7778,業務委託,高収入可能★働く時間も、日数も、あなたの自由★【ドライバー】 業務委託
株式会社沖縄ユーポス | 【 ユーポスグループ 】20代の若手社員が続々と入社しています,正社員,原則残業なし★働きやすい環境・高収入が手に入る！【 営業職 】 正社員
株式会社ファイン | 【ホテル正社員募集】書類選考は目を通す程度 ⇒ 完全人柄採用！,正社員,＼未経験→月30万!?／ 超★稼げるレジャーホテルの【店舗STAFF】 正社員
株式会社崎山組 | 平均年齢38歳／男性の育児休暇取得実績あり／有休平均年16日取得,正社員,【施工管理】★年休122日 ★1回の賞与で100万円の実績あり 正社員
株式会社アールブリッジ | 社会人デビュー大歓迎◆正社員登用あり◆WEB面接可◆,契約社員,【PRスタッフ】ウォーターサーバーのご案内/月収25万円以上可◎ 契約社員
株式会社ホマレ電池 | 創業87年の安定性が魅力｜風通しの良い社風,正社員,【工事スタッフ】蓄電池設備の点検・工事/未経験歓迎/若手活躍中 正社員
有限会社館 | ★入社1年以内に【月収35万～40万円】も充分目指せる！,正社員,レジャーホテルの【運営スタッフ】★未経験OK ★休日数が選べる 正社員
株式会社トラストワークス | エンジニアファーストを徹底！経験者が思わず唸る環境があります,正社員,【ITエンジニア】月給40万～確約★還元率70%以上★案件選択制★ 正社員
株式会社ショウエー設計測量事務所 | 1971年設立！安定した事業基盤でコロナ禍でも業績は好調！,正社員,【建築測量(墨出し)】高収入を目指せる会社/入社祝い金5万円支給 正社員
株式会社sizebook | 業界高水準の待遇★月25万～★完休2日★土日祝休★第二新卒歓迎,正社員,WEB広告の【ライター】★未経験歓迎★年収1000万円稼ぐ先輩も！ 正社員
東都興業株式会社 | 日本の農業を支える超安定メーカー★研修期間は1年間★賞与年3回,正社員,未経験OKの【ルート営業】★残業ほぼゼロ／年休130日以上！ 正社員
HRconsulting株式会社 | ◆完全週休2日(土日祝)◆年休124日◆基本定時退社◆高インセン,正社員,アパレル業界と求職者を繋ぐ【人材コーディネーター】★未経験OK 正社員
株式会社GL | 経験者は前職給与保証！｜土日祝休み｜大阪府緊急雇用対策に賛同,正社員,高収入が実現可能！年休128日(土日祝)【キャリアアドバイザー】 正社員
株式会社エディスト | 平均年齢26歳／月給30万円スタート／土日祝休み／服装自由,正社員,YouTubeの【動画編集スタッフ】★年間休日120日 正社員
三協電機株式会社 | 設立60年｜三菱電機など大手企業や官公庁と直取引｜WEB面接OK,正社員,地元のインフラに貢献！電気設備の【工事スタッフ】 正社員
株式会社XiT | 《業界を変えるベンチャー企業》―Redesign the last one mile―,業務委託,今すぐ働けて、月収50万円を当たり前に【デリバリーパートナー】 業務委託
株式会社エフテック | ◆残業月20H程度◆賞与年2回◆住宅、家族手当などの手当も充実,正社員,【自動車整備士】★月給25万円～★応募条件を満たす方全員と面接 正社員
株式会社山王 | 【新拠点オープニングメンバー大募集！】◎年間休日117日,正社員,”商品説明”で高収入♪【PRスタッフ】※鹿児島限定募集 正社員
株式会社コンセプト | 競馬関連のプロモーションを担う制作会社 ◎2週間の長期休暇あり,正社員,DMや新聞広告の【制作スタッフ】★未経験者も月給30万スタート！ 正社員
カンエツ興業株式会社 | 設立46年の総合建設会社 | 週休2日★賞与年2回★月給30万円～,正社員,【建築・土木施工管理】★夜間なし★残業なし★遠方なし！ 正社員
"株式会社SSコーポレーション | ★平均有給取得日数10日★GW,夏季,年末年始休暇あり★未経験OK",正社員,華やかなシーンを彩る♪【レンタカースタッフ】※残業少なめ 正社員
村田建設株式会社 | 元請け案件が8～9割／業績好調／社会福祉法人等と直取引を実現,正社員,【建築施工管理】※月給30～45万円と安定水準 ※決算賞与もあり 正社員
インフォシー株式会社 | ★グローバルベンチャー企業★年休120日以上★残業は月10h以下♪,正社員,【ITエンジニア】前職の給与よりも『増給』を必ず保証します！！ 正社員
廣川電機株式会社 | カネカ、サントリーなど大手と直接取引／資格取得支援あり,正社員,未経験から始める【メンテナンススタッフ】☆月給22万円以上 正社員
株式会社桜井自動車教習所 | ◆日祝固定休み＋土曜日交代制◆平均月収30万円◆賞与4.2ヶ月分,正社員,《締切間近》教習所の【インストラクター】※35歳以下面接保証※ 正社員
株式会社SSコーポレーション | ★1人1車体制★費用負担で大型免許の取得可能★長期休暇も充実,正社員,★実務未経験OK★【4tドライバー】※残業少なめ、1人1車体制 正社員
サムティプロパティマネジメント株式会社 | 【東証一部上場100％出資企業】★大阪府緊急雇用対策に賛同,正社員,オーナー対応などの【不動産管理】★月給27万円～/年休125日以上 正社員
社会福祉法人 枚方療育園 | ビアンエトール恭愛【大阪府緊急雇用対策に賛同】月8日休み,正社員,★未経験歓迎★【生活支援員】※賞与年3回（実績5.35ヶ月分） 正社員
株式会社ヘルセ | ◆設立以来増収増益 ◆国内40店舗を展開 ◆海外展開もスタート,正社員,海外の人気商品を国内に広げる【営業】★将来のマネージャー候補 正社員
株式会社SSコーポレーション | Glast(グラスト)/原則定時退社/GW・夏季・冬季の長期休暇あり,正社員,入社1年目～月給30万円以上！前職給与を考慮します【整備士】 正社員
日本フォーミング株式会社 | ◆基本土日祝休み◆ほぼ定時退社 ◎未経験大歓迎！,正社員,【営業事務】ワークライフバランス重視でプライベートを大切に！ 正社員
ロビンスジャパン株式会社 | SUUMO 関東 注文住宅・工務店ランキング2016～2020年第1位,正社員,【反響営業】ショールームの輸入住宅アドバイザー◆月給30万円～ 正社員
サイフォ株式会社 | ＼福岡トップクラスの知名度・実績があなたの営業活動を後押し／,正社員,収益用不動産の【売買仲介営業】年収1000万円も可/完全週休2日制 正社員
株式会社マリーロード | 《ラシュレディアコート》週休二日／賞与年2回／男女共に活躍中,正社員,喜びと感動がいっぱい【ウエディングプランナー】◎未経験歓迎 正社員
株式会社崎山組 | ＊1回の賞与で100万円の実績あり／男性の育児休暇取得実績あり＊,正社員,キャリアUP＆月収60万円も可能【機械オペレーター】★年休122日 正社員
株式会社GRAST | 都内8店舗展開！◎寮完備！◎安定収入がいい！,正社員,【店舗STAFF】コロナ禍でも100％給与保証！月給最大35万円＋賞与 正社員
株式会社ハウスクルーズ | 完全週休二日制/有給消化率100％/20代管理職歴あり,正社員,【ライフアドバイザー】45歳未満は全員面接！未経験でも高収入！ 正社員
"有限会社B.T | 関西電力グループ""きんでん""協力企業／大阪府緊急雇用対策に賛同",正社員,【電気通信スタッフ】★未経験OK＆年間休日150日以上も可能！ 正社員
株式会社トワードセントラル | 業績安定の食品配送／シフトも柔軟に組める◎/福利厚生が充実！,正社員,【ルート配送ドライバー】未経験でも月給29万円以上！賞与2回！ 正社員
株式会社ラングローブ | 未経験歓迎／月8-11日休み／残業月10～20h程度／稼げる環境◎,正社員,【完全反響営業】月収100万以上稼げる仕組みあり★残業少なめ 正社員
豊中機工株式会社 | ゴルフ場用芝刈り機などを取り扱う専門商社/土日祝休/年休125日,正社員,機械好きの方歓迎！芝刈り機の【メンテナンススタッフ】土日祝休 正社員
株式会社ONE | ◆平均月収40万円＆インセンティブあり◆面接時の交通費支給,正社員,お金を払う営業！ほとんどの方が未経験【買取営業】完全土日休み 正社員
株式会社Rush up | 成長率200％超えの成長企業【大阪府緊急雇用対策に賛同】,正社員,商品力があるから売りやすい！成果はインセンに直結！【営業】 正社員
株式会社シュテルン葛飾 | メルセデンス・ベンツ正規ディーラー/年休110日/毎月インセン,正社員,未経験からキャリアを積める【営業】年収700万円~可★20代活躍中 正社員
株式会社ケーシーエス・エス | 【大阪府緊急雇用対策に賛同】年収600万円以上も十分可能です！,正社員,【運搬スタッフ】入社2年目の平均月収40万円!! 稼げるワケとは!? 正社員
株式会社Rush up | 成長率200％超えの成長企業【大阪府緊急雇用対策に賛同】,正社員,自分だけのキャリアを築く 【企画営業】★1年以内に昇格多数！ 正社員
法成寺運輸株式会社 | 最近も未経験から20・30代の社員が入社★1年目で月収40万円可能,正社員,未経験OK【 4t・10tドライバー 】◎大型免許取得支援あり 正社員
株式会社スカーラサポート | 《面接1回》《社員の9割が月給30万円以上実現》《普通免許でOK》,正社員,【レッカーサービススタッフ】◎年齢不問 ◎福岡限定募集 正社員
株式会社エナジーシステム | #月20万円以上のインセン獲得者も！#未経験歓迎！,正社員,【モバイルアドバイザー】☆インセン充実☆完休2日制☆希望休可 正社員
株式会社ベクタークラフト | 大阪府緊急雇用対策に賛同★経験5年で年収620万円の社員も在籍,正社員,JW-CADのスキルが活かせる【設計】年休125日＋有休平均取得10日 正社員
株式会社ACE one | 年間休日122日｜毎月の歩合給で収入もアップ｜ノルマなし,正社員,プライベートと収入、どちらも譲れないあなたへ！【法人営業】 正社員
株式会社ひらぎの | 未経験から高収入が目指せる！UIターン支度金（10～20万円）あり,正社員,モデルルームへの来店者やお客様からの紹介が中心の【反響営業】 正社員
株式会社ウルテック | ★設立45年 ★未経験でも月給25万円以上 ★完全週休2日制,正社員,あなたの企画で“家”を作りましょう！【営業職】★未経験歓迎 正社員
株式会社ケーシーエス | 【入社1年目から月収40万円超も可能】完週休2日の働き方もできる,正社員,【総合職（ドライバー／運行管理）】自分らしい働き方が選べる！ 正社員
富国運輸株式会社 | 月給40万円以上も可！無事故手当(月最大7万円)など環境充実！,正社員,未経験OK！食品の【タンクローリードライバー】月給40万円～ 正社員
大東建託株式会社 | 【東証一部・名証一部上場】フレックスタイム制で働きやすさ◎,正社員,【提案営業】★業界TOPクラスのインセンティブ・待遇・評価制度 正社員
能丸政孝税理士事務所 | 北九州で創業30年以上の歴史！土日祝休み◎残業少なめ◎,正社員,税理士になりたい方を応援！【 税理士補助】実務未経験者OK！ 正社員
株式会社西家 | ◆大型連休年3回(GW/夏季/年末年始)→最大9連休 ◆週休2日制,正社員,若手活躍中★ON/OFF充実★月給30万円以上【営業】※残業月0~10h 正社員
三栄工業株式会社 | 創業64年！60歳以上の社員も活躍中★長く働ける会社です！,正社員,沖縄の街づくりに協力してくれませんか？【 技術スタッフ 】 正社員
株式会社フォーナイン | 120店舗⇒200店舗へ拡大中◆年休120日以上◆不況に強い安定業界,正社員,未経験歓迎！【営業】★原則定時退社 ★有給消化率ほぼ100％ 正社員
有限会社一成工業所 | ◎創業40年以上!安定の経営 ◎主な取引先は「名古屋市交通局」等,正社員,誰でも月給27万円スタート！【メンテナンススタッフ】 正社員
ケイエイツー株式会社 | 店舗拡大中の急成長住宅メーカー★2020年度グッドデザイン賞受賞,正社員,UIターン歓迎／WEB面接OK／引越代負担あり【経理】★月給25万円~ 正社員
"アークネット株式会社 | 「やる気スイッチ」のスクールIE,英会話スクール「WinBe」を運営",正社員,【教室長】★授業担当なし★優秀教室賞受賞×9月に新校舎OPEN 正社員
株式会社アスカクリエート | 賞与年3回支給(昨年度実績8ヶ月分)／残業なし／年間休日125日,正社員,保育士さんと保育園をつなげる【人材コーディネーター】広島募集 正社員
株式会社札幌解体建設 | 転勤なし／電話問い合わせもOK！ ⇒ TEL／011-865-6060,正社員,月収24万円以上も可！【総合職（作業員／重機オペ／施工管理）】 正社員
株式会社ホームケアサービス山口 | #福利厚生抜群　#業界随一の賞与　#資格取得をサポート,正社員,暮らしやすい地域づくりに貢献できる【ルート営業】 正社員
株式会社富士鳩急送 | ◆賞与年2回 　◆転勤なし！ ◆月収40万円も可能です！！,正社員,好きを仕事に！高収入GETも！【ドライバー】※女性活躍中♪ 正社員
"株式会社リグロス | REGLOS CO., Ltd.",正社員,未経験歓迎！【IT事務】研修9ヵ月／土日祝休／残業ほぼなし♪ 正社員
明興電設株式会社 | 30代で年収800万以上の先輩も活躍中★個人利用可能な社用車支給,正社員,稼げて休める【総合職(電気施工管理・現場スタッフ)】残業少なめ 正社員
株式会社GLOBAL BEAUTY | WEB面接OK・完休2日／複数事業を展開中のGLOBAL HOLDINGS GROUP,正社員,本部採用★飲食事業運営の【経営企画】／全国展開を促進する立場 正社員
