会社名,ステータス,キャッチコピー
株式会社Right Armサービス | 大手不動産管理会社や住宅メーカー多数と取引する安定企業,正社員,賃貸物件の【退去立会・点検スタッフ】未経験でも月給30万円～ 正社員
株式会社AOA | 【大阪府緊急雇用対策に賛同】平均年齢27歳◎2部も同時募集★,正社員,踏み出せ！よじ登ろう！高収入への道★稼げる【広告プランナー】 正社員
株式会社El．Assist． | (エレ アシスト) 昨今注目の、電力不足や光熱費上昇の課題も解決,正社員,【営業スタッフ】◇未経験OK！◇残業少なめ ◇月給23万円～ 正社員
株式会社Be-flow | 全国売上《トップ5位》は全員が当社の社員！,正社員,社員全員が月収100万円以上！月給25万円～×土日祝休【営業】 正社員
レイス株式会社 | 国内TOPクラスの総合コンサルティング会社,正社員,【営業】企業経営者が抱える様々な課題に対して解決手段を企画！ 正社員
株式会社ヨドバシカメラ | ★残業代100％支給★賞与年2回★社員割引あり★福利厚生も充実,正社員,【物流総合職】★第二新卒/未経験歓迎★週休4日など選べる働き方 正社員
株式会社ガイア | 月給25万円以上！培ってきた豊富な経験を活かしませんか？,正社員,大規模プロジェクト多数【開発許認可・土木設計コンサルタント】 正社員
株式会社山由製作所 | 大手食品メーカーの “新しい価値を生み出す” 技術パートナー！,正社員,世界に1つの製造設備をつくる【技術スタッフ】 ★未経験歓迎 正社員
株式会社エス・エル・エス福岡 | 総合レジャーサービスグループ(九州全県、広島県に35店舗展開),正社員,未経験OK【経営戦略・企画】店舗開発や経営まで幅広く経験できる 正社員
株式会社ジョイナス | 【1980年設立！上場企業と直取引】★賞与年2回＋別途インセン有,契約社員,スポーツ用品等の【自社製品のパッケージデザイナー】※契約社員 契約社員
株式会社SALTO | ＃年休132日＃フルリモート案件多数＃完全週休2日制,正社員,☆前給考慮☆Web面接1回のスピード選考【開発エンジニア】 正社員
株式会社秋山住研 | 【設立42年】地域に根ざした工務店◎100億企業を目指し拡大中！,正社員,完全反響型【営業】高品質＆低価格な住宅で商談チャンス豊富！ 正社員
株式会社R'zソリューション | 活躍の舞台は、大手メーカー工場★住宅手当あり／長期休暇あり,正社員,未経験から始める【 ロボットエンジニア 】年間休日123日/土日休 正社員
フォーザウィン株式会社 | ＜有休消化率100%／残業月平均15時間以下／年間休日125日＞,正社員,【設計エンジニア（機械/CAD）】★完全週休2日制（土日） 正社員
ディーエムソリューションズ株式会社 | JASDAQ上場／設立以来17期連続黒字経営！年休124日・土日祝休み,正社員,リピート率95%超の【企画営業】★最大30万円の引っ越し手当！ 正社員
菅原興業株式会社 | 【設立45年】＊転勤なし！職場近くにキレイな格安寮＆仮眠室あり,正社員,鉄道軌道の【工事・保守スタッフ】＊未経験でも月給40万円以上！ 正社員
株式会社京進 | 東証二部上場,FCオーナー,【学習塾経営】転職して社員に？いや、次のキャリアは独立だ！ FCオーナー
セットライフエージェンシー株式会社 | #残業月平均5時間以下 #初年度年収例：年収800万円/中途1年目,正社員,お客様とご家族の人生に寄り添う【ライフプランコンサルタント】 正社員
ワンダーグループ株式会社 | 面接1回／選べる働き方！土日祝休みor指定休日の中でシフト制♪,正社員,未経験OK！【採用人事・事務】早期キャリアUPも可能／年休120日 正社員
株式会社Al・assembly | ◎日勤のみ◎週休2日制の土日休み◎資格取得支援制度あり♪,正社員,正社員で活躍できる【組立配送スタッフ】◇年休115日◇賞与あり 正社員
"株式会社リオグループ | #入社1年6ヶ月／年収1,200万円 #入社8ヶ月／年収640万円等の実績",正社員,【総合職(店長候補・フロアスタッフ・営業・企画・広報)】 正社員
UTエイム株式会社 | 【東証一部上場グループ】”九州でずっと働きたい”を叶える！,正社員,【サポートスタッフ(PC入力・検査等)】★九州限定募集／転勤なし 正社員
UTエイム株式会社 | 【東証一部上場グループ】コロナ禍でも安定して成長中★,正社員,【製造管理事務スタッフ】九州限定★未経験OKの簡単作業 正社員
ユナイテッド＆コレクティブ株式会社 | 東証マザーズ上場★売上好調につき社員大募集！,正社員,年収550万円！月9日休＊入社祝金10万円【店長職】 正社員
リンク・プロフィット・システム株式会社 | 社食・食事補助あり／残業少なめ／公平な評価制度あり,正社員,【ITエンジニア(システム開発/インフラ構築)】☆月給30万円以上 正社員
オリンパス株式会社 | 消化器内視鏡分野で世界シェア70％の医療機器メーカー,正社員,医療現場を支える【カスタマーサービス】※研修・福利厚生充実 正社員
オリンパス株式会社 | 消化器内視鏡分野で世界シェア70％の医療機器メーカー,正社員,圧倒的な商品力で医療業界のトッププレイヤーを目指す【営業職】 正社員
UTパベック株式会社 | 【東証一部上場グループ】入社祝い金10万円支給エリア多数！,正社員,未経験歓迎【工場内作業(データ入力/検品)】★月収35万円以上可 正社員
グッドモーゲージ株式会社 | 昨年対比売上184％の成長企業！年間休日122日！完全週休2日制,正社員,【提案営業】「圧倒的な商品力」が「武器」に！年収平均700万円 正社員
佐藤建業株式会社 | 今年で創立61周年！杉並区・都内の地域に密着した工事事業を展開,正社員,【施工管理】官公庁・自治体からの依頼多数◎賞与年2回以上！ 正社員
税理士法人松本 | 業績好調&安定基盤◆新宿オフィス拡張移転しOPEN！◆男性活躍中,正社員,【税務会計スタッフ】★未経験大歓迎　意欲的な仲間と成長を！ 正社員
FUJINO HOUSE ENGINEERING株式会社 | 応募者は100％面接／残業ほぼなし／完全週休2日制(土日)もOK,正社員,選べる働き方！「休日重視」or「給与重視」【作業スタッフ】 正社員
株式会社ニューアート・シーマ | 日本最大級のダイヤモンド専門店『銀座ダイヤモンドシライシ』,正社員,全国募集／ブライダルジュエリーの【接客販売】★完全週休2日制 正社員
株式会社エービーシーホーム | ◆21年連続業績アップ◆既婚率7割◆インセンティブ年間最大16回,正社員,来年4月新店OPEN!【リフォームの提案営業】★年収1000万以上可能 正社員
株式会社HIRAYAMA | 《業績好調》黒字経営を続ける安定企業★月収37.5万円の高収入！,正社員,【重機オペレーター（ユンボ）】★年収500万円可 ★賞与年2回 正社員
株式会社窪治組 | ★転勤なし★社員寮完備★残業ほぼなし★実働7.5h★各種手当充実,正社員,【総合職(技術者/ドライバー/資材の搬入等)】★社会人経験者募集 正社員
株式会社本田住設 | #東証一部上場ダイキアクシスと直接取引#独立支援もあり,正社員,屋内作業が基本！住宅設備の【施工スタッフ】★高収入が可能 正社員
UTエイム株式会社 | 【東証一部上場グループ】社宅費や赴任旅費交通費は全額補助！,正社員,未経験歓迎【ものづくりスタッフ】志望動機不問＜東日本限定＞ 正社員
コーンズ・モータース株式会社 | ＜フェラーリ、ロールス・ロイスなど高級輸入車の正規代理店＞,正社員,【営業】★完全週休2日制★賞与計5ヵ月分支給＆高インセン有 正社員
株式会社ネオート | 未経験歓迎/20代活躍中！/ 月平均7万円のインセンティブあり,正社員,オープニングスタッフ募集【買取のお仕事】未経験でも30万円以上 正社員
株式会社太田興産 | JASDAQ上場（株）ジェーソンの持株会社◆銀座4丁目の自社ビル！,正社員,【不動産管理】★自社が所有する賃貸物件の管理・マネジメント★ 正社員
株式会社東名 | 東証・名証一部上場企業／残業少なめ／名駅スグ／女性社員活躍中,正社員,【ITコンサル営業】既存顧客／年休120日／オフィスカジュアルOK 正社員
株式会社山崎機械店 | 【創業76年の専門商社】賞与年2～5ヶ月／年収1000万円を目指せる,正社員,【総合職(営業・事務)】★残業月平均20h以内※未経験歓迎 正社員
シンエイホーム株式会社 | メリハリ付けて働ける＆高収入！子育て中のスタッフも活躍中◎,正社員,残業月10h程度！未経験からでも月給25万円【リフォーム作業員】 正社員
株式会社バグース | ★経験者優遇★賞与2回＋決算賞与★年3回10日程度の長期休暇あり,正社員,修繕工事の【施工管理】★月給33万円以上+インセンティブ！ 正社員
株式会社ピースリー | 積極面接中!!年休120日以上でプライベートも充実◎20代活躍中★,正社員,【営業職】土日休み高収入可能！家賃補助50％負担！？未経験OK！ 正社員
株式会社丸八ダイレクト | ◆名証二部上場「丸八グループ」◆WEB面接可◆報奨金・賞与年2回,正社員,【販売スタッフ】未経験でも月30万～可★嬉しい社宅有★学歴不問 正社員
株式会社ホンダクリオ南海 | 未経験歓迎／初年度年収400万円～※大阪府緊急雇用対策に賛同,正社員,未経験でも安心！リピート顧客9割の【提案営業】月給26万円以上 正社員
株式会社ゲッコー | 年2回5～7日の長期休暇アリ・直行直帰OK・転勤ナシ,正社員,材料や資材を運ぶ【技術系総合職】20代の平均月収〈約43万円〉！ 正社員
シティロード株式会社 | 大手舗装会社のグループ：資格取得支援も充実！WEB面接対応◎,正社員,【土木施工管理】★寮や充実な手当有り！・年間休日129日★ 正社員
株式会社ダイケンビルサービス | 創業63年の安定企業：残業月20時間以内・福利厚生も充実！,正社員,安定感抜群！【設備管理】未経験大歓迎！面接1回のスピード採用 正社員
コーンズ・モータース株式会社 | ＜フェラーリ、ロールス・ロイスなど高級輸入車の正規代理店＞,正社員,フェラーリの【セールスマネージャー】★初年度で年収870万～可 正社員
株式会社大崎産業 | 増収増益を継続中／公共工事をメインに安定した会社で働く！,正社員,土木基礎工事を通して大きな社会貢献【工事スタッフ】未経験歓迎 正社員
洋伸建設株式会社 | 五洋建設グループ◎施工管理技士2級⇒1級へキャリアUPも叶います,正社員,【土木施工管理】◎完全週休2日(土日祝)／年休120日以上 正社員
アイテル株式会社 | 全国6拠点募集／毎月選べる働き方／年収1000万円も目指せる,正社員,高級車の【カスタマイズスタッフ】賞与4ヶ月／年休120日超も可能 正社員
旭紙工株式会社 | 月給25万円~+賞与5ヶ月/基本定時退社/大阪府緊急雇用対策に賛同,正社員,未経験歓迎！花束やラッピングに使われる紙の【製造スタッフ】 正社員
株式会社タイセイリサイクル | リサイクル事業を展開＊環境省「エコアクション21」の認証取得,正社員,高収入×力仕事なし☆未経験でも始めやすい【工場作業スタッフ】 正社員
サンコーコンサルタント株式会社 | 社会インフラ整備を企画・設計する安定企業 ★賞与4.9カ月分,正社員,経験活かして無理なく勤務【電気設計エンジニア】＊土日祝休み 正社員
株式会社貴順 | 東日本トップクラスの宅配・配送企業★需要拡大中★寮制度あり,正社員,★正社員募集【サポートドライバー】未経験でも月30万円以上！ 正社員
関西不動産販売株式会社 | 16期連続で増収増益｜北摂エリアにてトップクラスの知名度＆実績,正社員,圧倒的な反響＝高収入を実現！【リフォーム営業】※業界未経験OK 正社員
株式会社カナクラ | #家族葬に特化#業績好調#高松市内中心#高松の成長中企業,正社員,完全週休2日制◎1年目で月収30万円が可能な【内勤営業スタッフ】 正社員
社会福祉法人ひまわり会 | 賞与年3回（4.8ヵ月分：前年実績）・産育休取得＆復帰実績も多数,正社員,日祝固定休み！公法人で安定のキャリアを築く【保育スタッフ】 正社員
関西不動産販売株式会社 | 16期連続で増収増益中｜固定給25万円を最低保証｜随時昇給あり,正社員,年間ボーナス1000万円の支給実績多数【不動産営業】業界未経験OK 正社員
株式会社未来図建設 | 【創業120周年の老舗企業】■転勤なし ■月給35万円～,正社員,【 営業 】※仙台営業所・幹部候補募集／厚待遇をご用意 正社員
株式会社ILLEST PLUS | 各業界の大手企業と取引あり／土日祝休み／年間休日120日以上,正社員,幅広い視点で、Webマーケティングを支援【企画営業】未経験もOK 正社員
株式会社ナチュレカード | 〈 建物検査事業 〉◎時間・場所、休み、収入が自由自在！,業務委託,副業やWワークとしてもOK！【 建物検査員 】40代～60代も活躍中 業務委託
株式会社ムラカミ | ◆業績好調◆転勤なし、香川でずっと働ける◆寮あり,正社員,残業ほぼなし◎お客様は香川県内の【ルート営業】※未経験歓迎 正社員
株式会社東名 | 東証・名証一部上場企業／残業少なめ／産休・育休取得実績あり！,正社員,未経験からオフィスワークデビュー★100％反響【内勤営業】 正社員
日本交通横浜株式会社 | 11年連続売上No.1*の日本交通グループ☆入社準備金30万円支給！,正社員,【EXドライバー(VIP・ハイヤー送迎)】ミドル活躍中／年収790万可 正社員
株式会社relation | 【大阪府緊急雇用対策に賛同】#自社内開発 #定着率95％以上,正社員,【SE・PG】希望が叶う理想のエンジニア像へ★年収1000万円も可★ 正社員
株式会社クレス不動産 | 反響営業だから、未経験でもムリなく稼げる＊,正社員,《多くの先輩が未経験スタート！》新築住宅の【不動産営業】 正社員
日本交通横浜株式会社 | 11年連続売上No.1*の日本交通グループ☆入社準備金30万円支給！,正社員,【ホスピタリティドライバー】女性・ミドル活躍中／充実保証あり 正社員
株式会社アクティブフュージョンズ | 前給保証！自社内開発・受託増加中★リモート／残業月10h以下,正社員,マネジメント「嫌」OK【SE/PG】年休125日・残業ほぼなし・自社内 正社員
株式会社キョウシン | 大阪府緊急雇用対策に賛同 ★完全週休2日！残業月平均5時間！,正社員,【賃貸営業】100%反響/最大34万円のインセンティブを毎月支給！ 正社員
株式会社アイタン | ★創業から21年連続売上UP★賞与年2回＋臨時賞与（4年連続支給）,正社員,消防設備の【法定点検スタッフ】月給30万円以上／未経験歓迎☆ 正社員
株式会社ZEROBASE | ノルマ・飛びこみ・テレアポなし★中途入社100％★年休120日,正社員,100％反響型の【不動産営業】★月30万～★残業ほぼなし＆完休2日 正社員
株式会社ソルエナジー | 未経験OK｜月給28万円以上｜残業ほぼナシ｜週休2日制(土日),正社員,太陽光発電・蓄電池・LED照明の【反響営業】 正社員
株式会社ユタカホーム | 創業46年の安定企業★年間休日120日★土日祝休み★基本定時退社,正社員,自社Webサイトをトータルに手掛ける！【Webディレクター】 正社員
株式会社レジット | 月給37万円も可能！/ 資格支援制度 / 服装・ヘアスタイル自由,正社員,【Webデザイナー】★年収800万円も実現できる★フレックス制 正社員
株式会社モトーレン福島 | 《福島県内唯一のBMW／MINI正規ディーラー》★県外転勤なし,正社員,未経験から成長できる！【反響営業】※福島限定募集・制度充実 正社員
株式会社メイズ | ☆賞与年3回☆完全週休2日制☆1週間以上の長期休暇×年2回,正社員,年休120日以上！高収入可能！未経験が活躍の職場！【法人営業】 正社員
株式会社キャリアサービス | 【年休125日以上】【産休育休実績あり】★20代・30代活躍中！,正社員,未経験月給35万保証！【人材コーディネーター】高卒以上 正社員
株式会社フカケン | ★20・30代の若手活躍中！★未経験者・経験者ともに歓迎！,正社員,元請け＆大手飲食店の【内装施工管理】★週休2日★月給80万も可 正社員
ウィンクルム株式会社 | 土日祝日休み ★月給25万円以上＋インセンティブ ★平均年齢27歳,正社員,スマホ決済サービスの【提案営業】※土日祝休み／未経験歓迎！ 正社員
株式会社データワンテクノロジー | 【業績好調】★10月に「浅草橋駅」スグの新オフィスに移転,正社員,【ITエンジニア】＊定着率90％ ＊土日祝休み ＊支援も手厚い 正社員
ウィンクルム株式会社 | 未経験でも月給25万円以上＋インセンティブ／完全土日休み,正社員,フードデリバリーサービスの【提案営業】※土日祝休／月給25万円 正社員
株式会社エール | 10月23日(土)開催のマイナビ転職フェア福岡に出展＠JR九州ホール,正社員,街で見かける似顔絵看板の【営業職】※年収800万円超も可能！ 正社員
Garrett Japan合同会社 | 【大人気ポップコーンのお店】★有給消化100％★正社員登用あり,契約社員,【店舗管理スタッフ】★完全週休2日制★年休123日★基本残業なし 契約社員
井本刃物株式会社 | 創業約100年｜自衛隊や東京消防庁でも当社製品が使われています,正社員,未経験歓迎！人気上昇中のDIYツールを手掛ける【製造スタッフ】 正社員
株式会社レーベンゼストック | 東証一部上場グループ★宅建保有者大歓迎★残業少なめ★土日休み,正社員,【営業】★土日休み＼未経験OK！「買い取る」営業にチャレンジ／ 正社員
株式会社マイナビM&A | マイナビグループの信頼を活かして、事業承継問題を解決！,正社員,安定基盤で成長できる【M＆Aコンサルタント】金融経験者が活躍中 正社員
株式会社ベルハウジング | ＜ 設立35周年 ＞グッドデザイン賞の住宅／未経験から成長できる,正社員,年齢・社歴に関係なく輝ける【営業】年収600万円も可能 正社員
株式会社セルモ | ＜セルモグループ＞冠婚葬祭業界のリーディングカンパニー,正社員,あなたの夢が叶う！インセンティブ充実★年収600万円可【営業】 正社員
グリーンアースパワー株式会社,正社員,貴金属・ブランド品などの買取営業 正社員
株式会社ツイテルホーム | 有給取得も推奨｜昇格チャンス年4回｜平均歩合支給額は月10万円,正社員,＼土日祝休み／【住まいアドバイザー】 ※未経験から高収入可 正社員
株式会社朋友 | 社員を最も大切に 有給取得率94％！｜定年以降も働ける会社,正社員,入社祝い30万円★【大型/中型ドライバー】月給30～最大50万円！ 正社員
西日本高速道路エンジニアリング中国株式会社 | 【NEXCO西日本グループ】◎年収600万円以上も目指せます！,正社員,【土木技術者(管理・点検・設計など)】◎年休120日×完全週休2日 正社員
株式会社松尾モータース | 未経験から、国家資格取得を支援！定着率も抜群です！,正社員,【整備士】軽自動車専門なので、体の負担が少ない＆残業ほぼなし 正社員
株式会社クラウディオサステナビリティ | 土日休み・年休120日以上・フレックスタイム制・リモートOK,正社員,大規模プロジェクトで活躍！【ITコンサルタント】 月給50万円～ 正社員
ホクセツハウス株式会社 | 【ホームメイトFC 高槻駅前店】#駅チカ #有給の取りやすさ◎,正社員,未経験≪大≫歓迎＊楽しく知識が身に付く【ルームアドバイザー】 正社員
株式会社古谷商事 | 大きな裁量権のもと、自分の店舗を持つことが出来る！,正社員,【飲食店スタッフ(調理・ホール)】◎未経験歓迎★応募者全員面接 正社員
日動工業株式会社 | LED照明や施設照明から便利商品まで企画開発する安定メーカー,正社員,空間を照らす”LED照明”を手掛ける！【製造スタッフ】年休129日 正社員
"東山管理センター株式会社 | 京都本社/創業65年以上/京都大学,桂離宮なども手掛ける優良企業",正社員,「京都」の水環境を守る【調査・メンテナンス】※年間休日125日 正社員
エヌケー貿易株式会社 | ◆昇給年2回 ◆賞与年2～3回,正社員,ゲーム機や玩具の【ECサイト運営】★賞与年2～3回★年休130日 正社員
オリエント住宅販売株式会社 | 広告投資に積極的だから集客力◎／20代～30代活躍中／実働7時間,正社員,年収1000万円は夢じゃない★【不動産営業】未経験OK・残業少なめ 正社員
株式会社九州電気保安センター | 【電話問い合わせもOK】土日の完全週休2日で基本残業なし！,正社員,希望に合った働き方ができる電気設備の【保守・点検スタッフ】 正社員
"株式会社Wisdom Technology | 土日祝休みの完全週休2日制！年収1,000万円以上も目指せます",正社員,上場企業との取引実績多数！上流工程にも携われます【 SE/PG 】 正社員
株式会社サーバントップ | 完全週休2日制／残業なし／業界高水準のインセンティブ制度,正社員,成長×結果×対価＝年収1000万以上も可！【法人営業】※土日祝休 正社員
エイトリンク株式会社 | 毎月インセンティブ＋賞与年2回有り！有給取得率100%,正社員,未経験歓迎！【企画営業】★転勤無し★女性7割★女性大活躍中！ 正社員
有限会社ゼロ・ワークス | ★ 普通免許があれば【全員面接】★｜大阪府緊急雇用対策に賛同,正社員,【技術スタッフ】★残業ほぼ０★直行直帰OK★平均月収30万円以上 正社員
山陽自動車運送株式会社 | 【大阪府緊急雇用対策に賛同】東証一部上場のグループ企業,正社員,あなたが『求めるもの』が当社にあります【2t・4tドライバー】 正社員
株式会社ARS | 残業少なめ＆完全週休2日でオフも充実！賞与年4回可！面接1回！,正社員,【メンテナンススタッフ】★年休123日★未経験・第二新卒歓迎 正社員
KSネットワーク株式会社 | 大手コンビニを手掛けているので業績も安定中♪,正社員,【 CADオペレーター 】内勤？外勤？あなたはどっち！ 正社員
株式会社コネクト | ◆転勤なし◆毎月インセン有＋賞与年3回◆1年目から高収入が可能,正社員,【法人向け企画営業】週休2日制（土日祝休み）／年間休日120日 正社員
アサカホーム株式会社,正社員,残業なし★商談無し★デスクワーク無し【不動産営業】未経験歓迎 正社員
イオンリチウムエナジー株式会社 | 【 平均月収80万円 】★隔週週休3日制 ★ノルマなし ★転勤なし,正社員,40代50代も活躍中！月給33.5万円～【 反響営業 】※ブランク不問 正社員
株式会社Markus | ＜増員募集＞★面接1回★年収1000万円も目指せる／残業ほぼ0,正社員,高級不動産の【賃貸営業】高インセンティブ × 昇給年4回★ 正社員
株式会社フレスタ | ITシステム開発サービスで急成長！◎副業OK◎残業少なめ,正社員,【インフラエンジニア】残業月平均6.5h /年休120日/定着率90％ 正社員
