会社名,ステータス,キャッチコピー
株式会社ガーヴェラ | 月給25.8万円～＋高率歩合給／ルールに縛られない働き方を推奨！,正社員,【中古マンション売買仲介】完全反響型／営業経験のある方優遇★ 正社員
株式会社 ADAMASエンタープライズ | ★注目の事業で売上げ拡大中★転勤なし★年間休日110日以上,正社員,お客様との信頼を築く【サービススタッフ】特別な知識＆技術不要 正社員
株式会社TAPP | IPO視野！売上150億見込の成長企業,正社員,100％インバウンド【営業クローザー】年収1000万超も可能 正社員
株式会社IDD | 未経験大歓迎/高収入/転勤なし/完全週休2日/ノルマ一切なし,正社員,★未経験大歓迎【通信コンサル営業】高収入・月収50万以上可能★ 正社員
株式会社グッドワークコミュニケーションズ | 1年目の平均月給36万円／研修2ヵ月／基本定時退社／年休120日,正社員,【営業職】◆1年目から高収入◆平均年齢27歳◆未経験入社95％ 正社員
脱毛の窓口 Tokyo Clinic | 日本橋院が2022年1月に新規オープン！／渋谷院／銀座院／大宮院,正社員,新規OPEN 医療脱毛クリニック【正・准看護師】未経験◎高収入☆ 正社員
株式会社家づくり本舗 | ◆完全週休2日制◆キャリアUPのチャンス豊富◆産育休実績あり,正社員,住宅ローンの【提案営業】★賞与最大年7回★完休2日★年休129日 正社員
株式会社FGGコーポレーション | 前給保証で更にスキルUP！/リモート勤務も可能/ソフト等もお任せ,正社員,前給保証◎【パース/CGデザイナー】自由な制作が購入の決め手に 正社員
株式会社ケイディアイ | 【東証一部上場のナックグループ】完休2日制・働きやすさ抜群,正社員,【営業系総合職（仕入企画営業／リノベーションアドバイザー）】 正社員
株式会社アミ―クス | 『トータルリペア』オーナー募集,FCオーナー,リペア職人として1人で独立！トータルリペアの【FCオーナー】 FCオーナー
株式会社アスタイル | 確かな信頼と実績を誇る総合不動産企業,正社員,【不動産売買営業】★未経験大歓迎★週休2日制★残業月25H 正社員
東建コーポレーション株式会社 | WEB面接実施！『 年齢に関係なく、まだまだやれる会社です！』,正社員,40～50代で転職の先輩、活躍中【営業】全国/未経験歓迎/年齢不問 正社員
日研トータルソーシング株式会社 | 【大阪府緊急雇用対策に賛同】★オンライン説明会開催中！,正社員,AI・自動化で話題の業界！【ロボットメンテナンス】◆未経験歓迎 正社員
UTエイム株式会社 | 大阪府緊急雇用対策に賛同【東証1部上場グループの安定基盤】,正社員,通勤しやすい職場で働く♪【倉庫内作業スタッフ】※土日休み可能 正社員
マルデナポリジャパン株式会社 | 100店舗チャレンジ始動★新ポストもあり未経験者もチャンス十分,正社員,未経験OK★好待遇あり★有名イタリアンの【店長・SV候補】 正社員
東建コーポレーション株式会社 | ＜転職成功者が多数＞年収320万から、860万を実現した先輩も◎,正社員,目指せ！年収UP【営業系総合職】年齢不問/全国・社会人経験募集 正社員
加納コーポレーション株式会社 | 賞与年2回、昇給年4回、完全週休2日制など、各種体制完備。,正社員,【もんじゃ焼き店長候補】経験を活かして次のキャリアへ 正社員
日研トータルソーシング株式会社 | 大阪府緊急雇用対策に賛同　★応募から1～2週間でスピード内定可,正社員,好きな街で働けるものづくり【サポートスタッフ】年休最大160日 正社員
新日本住設EAST株式会社 | 【7年連続140％売上伸長の安定基盤】★年収1000万円以上も可能！,正社員,名古屋限定募集！【営業スタッフ】★未経験歓迎＆月収80万円も可 正社員
悠悠ホーム株式会社 | ◎完全週休2日制 ◎充実の手当は10種類 ◎業界・業種未経験OK,正社員,【総合職】高い知名度&地場No.1の安定企業で長いキャリアを描く 正社員
ポラス株式会社 | 14年連続住宅販売No.1！知名度バツグン！地域に根差した安定企業,正社員,頑張り次第で高収入OK！豊かな生活を提案する【営業系総合職】 正社員
UTエイム株式会社 | 【東証一部上場グループ】★WEB面接OK／今月入社も可能,正社員,未経験・第二新卒OK【総合職(組立・検品等)】★月収42万円以上可 正社員
株式会社千葉東建設 | 未経験でも月給25万円～＋歩合給＋賞与年2回＋各種手当,正社員,100％反響型・ノルマなし【ハウジングアドバイザー】完全週休2日 正社員
株式会社平和地建 | 人々の暮らしに笑顔を増やす。なくてはならない企業となるために,正社員,不動産を通して、驚きと感動を生む。【反響営業】※未経験OK 正社員
UTコンストラクション株式会社 | 東証一部上場グループ★大手ゼネコンへの転籍実績も多数,正社員,前職給与保証!!【施工管理スタッフ】※土日休／残業月平均20時間 正社員
クリーンデバイス・テクノロジー株式会社,FCオーナー,カーエアコンクリーニング「空気の洗車屋さん」【FCオーナー】 FCオーナー
益三建設株式会社 | ＜設立50年！地域に愛された会社＞＊UIターン歓迎＊住宅手当あり,正社員,企画型注文住宅の【ホームアドバイザー】★業界・職種未経験歓迎 正社員
大同生命保険株式会社 | ★業界経験一切不問 ★有給取得実績多数 ★転勤なし ★土日休み,正社員,基本17時退社★平均月給42.9万円【法人営業】※社会人経験者限定 正社員
新日本住設EAST株式会社 | 【7年連続140％売上伸長の安定基盤】★年収1000万円以上も可能！,正社員,仙台限定募集★【営業スタッフ】★月収80万円も可能！未経験歓迎 正社員
株式会社エフティグループ | ★東証JASDAQ上場総合商社・安定性抜群★年休120日★WEB面接1回,正社員,【ソリューション営業】★年功序列なし！月給50万円スタート可！ 正社員
新日本住設EAST株式会社 | 【7年連続140％売上伸長の安定基盤】★年収1000万円以上も可能！,正社員,未経験歓迎！【営業スタッフ】★月収80万円も可能！★全国募集 正社員
株式会社三和交通統轄本部 | 有給消化98％/サービス残業0/賞与年2回/予約年200万件,正社員,【フードデリバリードライバー】未経験歓迎★給与保障有(規定有) 正社員
UTエイム株式会社 | 【超スピード選考】最短当日面接＆当日採用(規定有)！,正社員,【自動車製造スタッフ】転籍実績も多数！★月収42万円以上も可！ 正社員
株式会社アーキ・ジャパン | 平均月収53万円(施工管理・技術職)【大阪府緊急雇用対策に賛同】,正社員,《希望の勤務地》《高収入》《望む働き方》を実現！【施工管理】 正社員
株式会社テクトン | WEB面接可／20代・30代活躍中／年間休日125日／土日祝休み,正社員,IT×人材ビジネスの専門スキルを磨く！【人材コーディネーター】 正社員
株式会社吉安建設 | ＜大正5年創業＞熊本・菊池の総合建設会社／転勤なしで働ける,正社員,【施工管理(土木/建築)】★昇給年2回 ★賞与年3回 ★月給28万円~ 正社員
株式会社LEVELY | ★未経験歓迎(研修充実)／完全週休2日／女性活躍中／複数名採用,正社員,★未経験歓迎【エステティシャン】＼オープニングスタッフ募集／ 正社員
メットライフ生命保険株式会社 | 大阪アーバンエイジェンシーオフィス｜幅広い年齢層が活躍中！,正社員,【コンサルティング営業】豊かな人生を手に入れるため、働く。 正社員
HITOWAライフパートナー株式会社 | 全国募集★自宅開業OK★転勤なし◎未経験歓迎！学歴・スキル不問,FCオーナー,全員面接★高収入も目指せる◎手に職が付く仕事【FCオーナー】 FCオーナー
ハウスリンクホーム株式会社 | ■年休130日 ■残業月10h程＆残業代100％支給 ■社宅4.5万円補助,正社員,20～30代の未経験者が活躍中【不動産の仕入れ】■月給27.8万円～ 正社員
株式会社エアコン名人 | 　【IT×設備で成長中！】立ち上げメンバー/アプリで業務効率化,正社員,95%未経験！それでも月給40万。手に職の【サービススタッフ】 正社員
BSCモーゲージバンク株式会社 | ★業界No.1・東証一部上場ARUHIのFC企業として圧倒的シェア！,正社員,圧倒的ブランド力×高歩合！ 未経験から始められる【提案営業】 正社員
株式会社神美 | 女性専門のセルライトケア『THE PERFECT LINE』を全国に展開！,正社員,【エステティシャン】*女性活躍中*完全週休2日*年休120日 正社員
株式会社ムーブリフォーム | オープニングStaff募集◆未経験でも月15万円以上の歩合獲得可能,正社員,成約率30％以上！お客様に喜ばれて稼ぐ【営業職】完全週休2日制 正社員
株式会社T-TOP | コロナ禍でも業績好調｜オープニング募集｜平均月収40万円,正社員,月給28万円スタートも可能★【営業スタッフ】※埼玉限定募集※ 正社員
株式会社PEO | 東証一部上場アウトソーシンググループ◆賞与年2回◆退職金制度,正社員,今だけ特典総額140万円！【製造スタッフ】★土日休み★豊田募集 正社員
株式会社WILL | 「MOODYZ(ムーディーズ)」「S1(エスワン)」などを手がける企業！,正社員,アダルト作品をプロデュース！【プロデューサー】★未経験大歓迎 正社員
株式会社御剣商事 | ★★関西 積極採用中★★嬉しい福利厚生：理美容補助金など,正社員,＼20代の若手活躍中／【キャリアアドバイザー】※残業ほぼなし 正社員
株式会社ウイルテック | 〈自動車関連の製造スタッフ募集〉★毎週土日休み/残業も少なめ,正社員,★完休2日★年休121日！1年目から月収40万円超が可能【製造】 正社員
住友不動産販売株式会社 | 【東証一部上場住友不動産グループ】,正社員,【不動産売買仲介営業】◇営業職の半数以上が年収800万円超 正社員
株式会社アサンテ | <東証一部上場>★創業50年&国内売上No.1の安定基盤★未経験OK,正社員,年齢&経験不問！【営業】★手取月50万～も可能★賞与4ヵ月分 正社員
株式会社エージェントゲート | 化粧品メーカー等と取引/産育休取得＆復帰100％/残業基本なし,正社員,シフト制・夜勤の働き方を変えよう*年休130日【ITヘルプデスク】 正社員
株式会社エージェントゲート | 大手プライム多数/前職以上の給与最大限保証/リモート勤務有,正社員,常時1600件！技術を極めるも上流も、希望実現【SE・PG】 正社員
株式会社センス | ★未経験からでも年収1000万円超の先輩が活躍中★100％面接保証,正社員,【営業系総合職】週休3日／月末5連休などユニークな働き方も◎ 正社員
株式会社グッドライフ | ◇社員の多くが入社3～5年目に年収600～800万円を超えを実現◇,正社員,【インサイドセールス】未経験者歓迎！入社3ヵ月で即昇格も可能 正社員
株式会社エージェントゲート | 直近も増益の安定基盤/残業基本なし/リモート勤務も実施中です,正社員,年休130日！IT未経験OK！安定の手に職をプラス【IT事務】 正社員
株式会社ビルドイット | 設計からの請負い案件100％で高収入可 ★残業全社平均月10h以下,正社員,★前給保証★前職年収2割増しを保証【ITエンジニア】年休128日 正社員
株式会社貴順 | ★未経験歓迎★週・日払い可★男女活躍中★契約祝金最大10万円！,業務委託,【軽ドライバー】都会で稼ぐ！月収50万円も可能★支度金＆寮制度 業務委託
クルーガーグループ株式会社 | 1ヶ月半の研修で未経験も安心◆全国募集で転勤なし◆福利厚生◎,正社員,未経験から始める【ルートセールス】☆45歳以下限定 ☆面接保証 正社員
ME不動産東葛株式会社 | 9割が未経験入社★拠点拡大に伴い、未経験から役員を目指せる！,正社員,【不動産営業】完全週休2日制★賞与あり★飛び込みテレアポなし 正社員
株式会社エネクスコンサルティング | 【ENEX Holding Co.】土日祝休みの完全週休2日制★年休120日以上,正社員,”自己成長”のための転職を―。【 法人営業 】*未経験者も歓迎 正社員
有限会社ダイイチ機設工業 | 未経験でも、学歴に自信がなくても高収入を目指せます！,正社員,未経験歓迎【 技術スタッフ 】年2回のボーナスで平均180万円支給 正社員
株式会社ネクステージ | ◎東証・名証一部上場 ◎土日祝休も可 ◎平均年収740万円,正社員,店舗型営業【カーアドバイザー】★地域限定職採用 ★転勤ナシ 正社員
プレミアムウォーター株式会社 | ★年間休日180日以上＆残業月15時間以内 ★月収30万超も可能,正社員,上場企業グループで働く【製造スタッフ】★未経験歓迎 ★残業少 正社員
株式会社ワイズ高橋 | 業界でも珍しい、弊社ならではの買取職にご注目！退職金制度あり,正社員,高級輸入車店の【総合職(販売・買取)】★未経験歓迎 正社員
株式会社ゴールドファステート | 【20代の若手が多数活躍中！】※大阪府緊急雇用対策に賛同,正社員,"未経験スタート9割【営業】★残業10h ★平均年収1,000万円以上 正社員"
株式会社いーふらん | 買取専門店「おたからや」を全国1300店舗(出店待機含)展開！,正社員,【買取営業】入社初月収50万円超続出！／完全反響営業／経験不問 正社員
東京エムケイ株式会社 | 月収実績:タクシー81.3万円/ハイヤー119.8万円★有給取得80％超,正社員,最高級サービスを届ける【コンシェルジュドライバー】※学歴不問 正社員
テレック株式会社 | 土日祝休みOK／産・育休完備／入社2年目で月給34万円も可能,正社員,【受付】完全週休3日・年休156日・原則定時退社・月給23万円以上 正社員
アップライブステージ株式会社 | テレワークの普及に伴い売上も2倍◎実績給で最高70万円支給有,正社員,【ライブ配信コーディネーター】★タレント発掘＆育成★高卒以上 正社員
株式会社あひるコンサルティング | ★目標は自分で決めるもの。自分を律して「ガッツリ」稼ぐ！！★,正社員,しっかり稼ぐ！【コンサルティング営業】★未経験でも固定給保証 正社員
株式会社ユタカホーム | ★残業1日1H以下 ★転勤ナシ ★定着率97％ ★完全週休2日制,正社員,未経験でも月給37万円以上！【施工管理】★引っ越し手当など充実 正社員
株式会社京栄コンサルティング | 法人営業（年収例:720万円/25歳/中途入社4年目）,正社員,【法人営業】◆人材×Web集客◆ベンチャー企業◆月給25万円以上 正社員
株式会社ワークナビ | [創業以来売り上げ増加中]■2021年ベストベンチャー100に選出！,正社員,"『楽しく稼げる会社』""NO.１""を目指す！【法人ルート営業】 正社員"
エーアイアールグループ合同募集 | ★中途採用者活躍中★20～30代男性活躍中★残業少なめ★研修充実,正社員,【ルームアドバイザー】★1年目で月収85万円以上可★11月入社可 正社員
株式会社ホットスタッフ博多 | 北九州、行橋、小倉、飯塚、新宮、久留米に拠点を展開！,正社員,人材派遣会社の【 営業職 】★経験ゼロでOK！まずはご応募下さい 正社員
実用春日ホーム株式会社 | <「文京区に特化、13店舗展開」が強み！>★平均残業30時間以内★,正社員,店長の平均月給51万円！【不動産営業】★店長候補★賞与年3回！ 正社員
株式会社リライズ | 研修制度・資格取得支援！未経験でも成果が出せる仕組み！,正社員,◎未経験から高額インセン/業界成約率の4～5倍！【不動産営業】 正社員
アプライド マテリアルズ ジャパン株式会社 | 「初任給が高い」未上場企業ランキング第2位,正社員,【保守修理スタッフ】学歴不問◆年間休日123日◆北陸エリア募集 正社員
株式会社エムズクリエイティブシステム | 《前給保証》《社長も元エンジニア》《昨対比130％増で成長中》,正社員,定着率98％！“ずっとここで――”と思える会社【ITエンジニア】 正社員
アプライド マテリアルズ ジャパン株式会社 | 「初任給が高い」未上場企業ランキング第2位,正社員,【保守修理スタッフ】学歴不問◆年間休日123日◆広島県募集 正社員
アプライド マテリアルズ ジャパン株式会社 | 「初任給が高い」未上場企業ランキング第2位,正社員,【保守修理スタッフ】学歴不問◆年間休日123日◆九州エリア募集 正社員
アプライド マテリアルズ ジャパン株式会社 | 「初任給が高い」未上場企業ランキング第2位,正社員,【保守修理スタッフ】学歴不問◆年間休日123日◆三重県募集 正社員
アプライド マテリアルズ ジャパン株式会社 | 「初任給が高い」未上場企業ランキング第2位,正社員,【保守修理スタッフ】学歴不問◆年間休日123日◆京都府募集 正社員
アプライド マテリアルズ ジャパン株式会社 | 「初任給が高い」未上場企業ランキング第2位,正社員,【保守修理スタッフ】学歴不問◆年間休日123日◆関東エリア募集 正社員
アプライド マテリアルズ ジャパン株式会社 | 「初任給が高い」未上場企業ランキング第2位,正社員,【保守修理スタッフ】学歴不問◆年間休日123日◆東北エリア募集 正社員
日野自動車株式会社 | 東証一部上場・TOYOTAグループ・家具付き無料寮完備(光熱費無料),契約社員,【製造スタッフ】★入社祝金・３ヵ月毎の慰労金有★＜全国募集＞ 契約社員
株式会社グランドジャパン | 20代歓迎/住宅手当3万/8日間の連続休暇可/福利厚生充実,正社員,"将来の幹部候補【不動産営業】未経験大歓迎/初年度年収1,500万可 正社員"
株式会社GoodWorkJapan | ★全国募集 ★収入UPを実現した先輩多数 ★残業少なめ,正社員,【施工現場の管理スタッフ】★面接1回★年間休日120日以上 正社員
株式会社ジーアフター | 輸入車・国産車の買取、販売◇売上前年比130%成長で不況知らず！,正社員,車販売の【営業・店舗運営】未経験者も月給30万以上でスタート！ 正社員
株式会社ウイルテック | <未経験歓迎！>月収45万円以上も可能な好待遇／世界各国が勤務先,正社員,大手メーカー内で活躍！半導体製造装置の【据付・調整スタッフ】 正社員
株式会社テクトン | 「未経験で心配・・・」そんなあなたを応援する会社,正社員,★接客・販売職からの未経験入社多数★Excel研修あり【事務職】 正社員
新日本ハウス株式会社 | 転勤ナシ＝好きな街で働けます！吉幾三さんのCMでおなじみの会社,正社員,40～50代も活躍中★お客様に喜びを与えられる【リフォーム営業】 正社員
中部自動車販売株式会社 | ★創業以来黒字・無借金経営 ★10月本社を新自社ビルに移転！,正社員,【カーライフアドバイザー】年収1000万円以上可能★完全反響 正社員
株式会社ホンダカーズ中央佐賀 | 《 佐賀からの転勤なし 》借上社宅/積立有給休暇/社割など充実☆,正社員,《 完全人柄採用 》安定した生活水準を送ろう！【 営業 】 正社員
株式会社あひるコンサルティング | 業界未経験者も活躍できる、残業も少なめで働きやすい環境です,正社員,"人気住宅ローン""フラット35""の【 ルート営業 】高収入も目指せる 正社員"
株式会社要 | ＜ゲームやアプリ開発、インフラ構築など案件豊富＞※経験者歓迎,正社員,【ITエンジニア(開発/インフラ)】★残業平均7H以下★有給即付与 正社員
株式会社優誠 | 【大阪府緊急雇用対策に賛同】ノルマなし＆成約率は50％以上！,正社員,【営業スタッフ】未経験OK／月収100万円超も可能／基本土日休み 正社員
株式会社ハマエンジニアリング | 【TV＆WEBCM絶賛放映中】賞与年3回★20代で年収450万円超えも可,正社員,＼大分・長崎限定採用／ 【半導体メンテスタッフ】※交代勤務 正社員
株式会社トップ | 《トップHDグループ》33歳*月給例:月給29.1万円＋インセン＋賞与,正社員,3人に1人は年収1000万円！【 提案営業 】*全国募集*経験者募集 正社員
株式会社PENTAGON | 月給27万円～/入社1年目平均年収は480万円/頑張りは正当に評価◎,正社員,仙台限定募集＆転勤なし【ダイレクトセールス】★面接保証★ 正社員
株式会社PENTAGON | 頑張りは正当に評価◎/1回のインセンティブで100万円稼ぐ人も！,正社員,★大阪・滋賀・高松・姫路募集★【ダイレクトセールス】転勤なし 正社員
株式会社TERASS | 定着率94.9%/仲介手数料の75％が年収/副業OK/面接1回,業務委託,フルリモート【不動産売買仲介エージェント】※業界経験者募集 業務委託
東京エムケイ株式会社 | ハイヤー月収実績119.8万円※2021年8月度支給実績/男性育休実績,正社員,年収1000万円も可能！【高級車ハイヤーのドライバー】※高卒以上 正社員
株式会社テイクス | 【新宿事業所】21年連続増収増益！上場企業グループ会社,正社員,【ITエンジニア】キャリアの実現に向け徹底サポート！高卒以上 正社員
株式会社テイクス | 【本社】個性・長所を伸ばす風土！上場企業グループ会社,正社員,【ITエンジニア】積極採用ついにスタート！Web面接可！学歴不問 正社員
住宅セレクション株式会社 | 《引越費用半額負担有！全国から神奈川湘南で働きたい方大歓迎》,正社員,【不動産営業】★完全週休2日制 ★年間休日115日 ★残業少 正社員
株式会社オープンハウス | 東証一部上場◆20代の管理職率76％◆年4回昇給&昇格のチャンス有,正社員,【総合職】人事/提案営業◆未経験歓迎◆20代の若手が活躍中 正社員
株式会社杉並モータース | ★残業代100%支給★有休取得率ほぼ100％ ★Web面接OK★日勤勤務,正社員,未経験歓迎♪平均月収45万円！【ロードサービス】※育成枠採用 正社員
株式会社京栄センター | 《名古屋/東京/宇都宮/大阪/京都/福岡での募集》平均年齢27.5歳,正社員,未経験OK！自分が成長できるステージへ【人材コーディネーター】 正社員
株式会社サンテック | 【圧倒的安定感】業界大手×インフラ事業／コロナ禍でも業績好調,業務委託,割り振られた案件をこなして月収50万円超【家電修理スタッフ】 業務委託
株式会社ミックウェア | ★ホンダやトヨタのパートナーとして最先端技術を駆使！,正社員,働き方が選べる【ITエンジニア】大量採用!中途入社が多数活躍中! 正社員
東日本住宅株式会社 | <50期連続で黒字経営の成長企業＆新店OPEN予定>★未経験者歓迎,正社員,ニーズ拡大！UR(公団)・公社住宅等の【営業】★1週間以内で内定 正社員
日本交通株式会社 | 三鷹営業所★飲食関連や個人事業主など前職様々なメンバーが活躍,正社員,働きやすさが自慢！【総合職(乗務員・キッズ・ケアサポート等)】 正社員
株式会社京進 | 東証二部上場,契約社員,"【学習塾教室長】独立を目指し、教室長として""経営""を学べる！ 契約社員"
株式会社ＺＵＮＤ | ★姫路から世界へ！宇宙一のラーメン屋を目指すための増員募集★,正社員,『ラー麺ずんどう屋』のスープや麺をつくる【製造スタッフ】 正社員
