会社名,ステータス,キャッチコピー
Rセキュリティ株式会社 | 20年連続増収増益◆2020年2～5月は売上前年比”125％以上”,正社員,"未経験から""鍵のレスキュー""を担うエキスパートに！【錠前技師】 正社員"
株式会社あおぞら不動産管理 | 年収1000万円以上も可能！土日祝休み！年休126日！業績好調！,正社員,【不動産コンサルティング営業】★成約率80％★経歴よりも人柄！ 正社員
エムケイ株式会社 | 【大阪府緊急雇用対策に賛同】★社員寮完備★昼勤or夜勤を選択可,正社員,【観光コンシェルジュ(ドライバー)】※月給25万円～/給与保証有 正社員
株式会社ビッグモーター | ★実績：未経験女性営業・入社1年で、最高月収60万円超え！,正社員,【販売・買取スタッフ】★女性活躍中！ ※40歳以下募集 正社員
UTコンストラクション株式会社 | 東証一部上場グループ★大手グループの安定基盤★土日祝休み,正社員,☆未経験歓迎☆【総合職(管理・資料作成等)】★残業月平均17時間 正社員
株式会社ロジカル | 面接1回で内定★高収入を見込める新制度も！★コロナ禍でも安定,正社員,【ルート営業】前職から10万円以上、給与がUPしたスタッフも！ 正社員
株式会社ビッグモーター | 平均年収957万円◆前職月収15万⇒月収150万円になった先輩活躍中,正社員,『こんなに稼げるの！？』【販売・買取営業】*社会人経験者募集 正社員
Rセキュリティ株式会社 | 20年連続増収増益◆2020年2~5月は売上前年比125％◆完全週休二日,正社員,"""水""というライフラインを支える【水道技師】★平均月収45万円超 正社員"
アプライド マテリアルズ ジャパン株式会社 | ◆売上世界No.1の半導体製造装置メーカー◆年間休日123日,正社員,高収入を実現！平均年収734万円【エンジニア・技術職】全国募集 正社員
UTコンストラクション株式会社 | <東証一部上場グループ>家電家具付き社宅＋6割補助＋引越費支給,正社員,【点検・保守】未経験歓迎☆日勤/基本土日休み/平均月収29万円 正社員
KUROFUNE＆PARTNERS株式会社 | #飛び込み・テレアポ業務なし #社用車支給 #転勤なし,正社員,【買取査定スタッフ】未経験歓迎／月給30万円スタート／車通勤OK 正社員
UTエイム株式会社 | 【東証1部上場グループ】何十年先も、重宝される人材へ！,正社員,ゼロからスキルUP!【ロボットエンジニア】未経験歓迎/日勤勤務 正社員
住友不動産株式会社 | 転勤なし/6ヶ月の研修と現場配属後のフォローアップあり！,正社員,【注文住宅営業】経験者募集/平均年収740万円！※充実の研修あり 正社員
株式会社ビッグモーター | 免許なし＆ハンドルを握ったことがなかった先輩も活躍中♪,正社員,経験・学歴・年齢などは全て不問！【営業職】★平均年収957万円 正社員
株式会社アイダ設計 | 1都2府20県へエリア拡大中／テレビ・ラジオCMでもお馴染みの企業,正社員,WEB集客多数★商談チャンスが多い【住宅営業】※男女活躍中 正社員
"イーゲート株式会社 | ◆""いま""伸びている再エネ事業で成長中◆年休120日以上",正社員,【反響営業】#月給35万～#完週休2日#面接1回#20～30代活躍中 正社員
株式会社ロジカル | 面接1回で内定★高収入を見込める新制度も！★コロナ禍でも安定,正社員,土日休みで家族との時間をしっかり過ごせる【ルートサービス】 正社員
クルーガーグループ株式会社 | 全国で複数名採用◆面接1回◆自由な休みで週休3日も可能,正社員,安定環境で活躍する！【ルート営業】☆未経験歓迎 ☆年齢不問 正社員
株式会社ビッグモーター | *＼未経験歓迎／* イチから丁寧にレクチャー＆マニュアル完備！,正社員,業界No.1の安定企業で働く【登録事務スタッフ】☆基本定時退社 正社員
株式会社UPSTART | 平均年齢25歳◆コロナでも安定成長！売上高約10億円,正社員,10代20代活躍☆免許不要◎未経験歓迎！月給30万【営業】学歴不問 正社員
株式会社エストゥルース | 【当社の実話】土日祝休み/残業ゼロ/未経験入社でも年収1200万円,正社員,【営業スタッフ】＼育成枠採用／⇒チームであなたを育てます 正社員
株式会社ミュゼプラチナム | 美容脱毛専門サロン売上NO.1！全国に169店舗を展開する大手企業,正社員,未経験OK★全身美容脱毛0円【総合職(受付・エステ・企画・PR)】 正社員
UTエイム株式会社 | 【東証一部上場グループ】★オンライン面接実施中→12月入社可！,正社員,未経験歓迎【物流管理事務スタッフ】ワークライフバランス良好◎ 正社員
株式会社NEXT STORIES | ★入社祝い金10万円有★年収1000万可※大阪府緊急雇用対策に賛同,正社員,【アフターフォロー営業】■月給30万～&完休2日制■テレアポなし 正社員
株式会社アール・エム | 大阪府緊急雇用対策に賛同/正当評価で高収入/20代年収例1500万超,正社員,【WEBの提案営業】★2021年度の営業職：最高月収165万円！ 正社員
UTエイム株式会社 | 【東証一部上場グループ】社宅費補助エリア多数⇒貯金しやすい！,正社員,転勤なし★好きな街で働く【総務事務】未経験歓迎/年休127日以上 正社員
株式会社ミュゼプラチナム | 履歴書不要の人柄採用 ★ 美容脱毛0円 ★ 月収29万円も可能,正社員,【受付カウンセラー】未経験OK★高卒以上★年齢不問★賞与年4回 正社員
株式会社リプロ | 試用期間中は月給25～50万円の給与保証！安心して成長できます,正社員,【提案営業】営業社員の平均年収811万円！みんな未経験スタート 正社員
株式会社モリシン電気設備 | 【会社の紹介動画付き求人！気になる方はCLICK】月収40万円も可,正社員,未経験から高い技術を手に！【電気工事】経験者は前職給与を考慮 正社員
日研トータルソーシング株式会社 | 大阪府緊急雇用対策に賛同／未経験歓迎・WEB面接実施中！,正社員,もくもくと自分らしく働ける仕事！【在庫管理・検査スタッフ】 正社員
株式会社ビッグモーター | 【業界No.1】平均年収957万円◆表彰式あり◆未経験歓迎◆面接1回,正社員,2年目で年収2389万円の実績【車の営業（幹部候補）】 ※高卒以上 正社員
"株式会社フレックス | 八尾,東大阪,大東,吹田,奈良の募集/大阪府緊急雇用対策に賛同",正社員,土日祝休＆転勤なし★大阪ガスグループの【ライフアドバイザー】 正社員
日研トータルソーシング株式会社 | 【大阪府緊急雇用対策に賛同】年休最大160日◆好きな街で働ける,正社員,ものづくりの【アシスタントスタッフ(メンテナンス補助等)】 正社員
UTエイム株式会社 | 【東証一部上場グループ】★WEB面接OK,正社員,コツコツ働ける♪【箱詰め・梱包スタッフ】未経験歓迎 正社員
株式会社PEO | 【東証一部上場アウトソーシンググループ】◆オンライン面接OK！,正社員,トヨタで活躍【製造スタッフ】未経験OK/月給27.7万~/田原市勤務 正社員
シーズクリエイト株式会社 | <上場企業>★年収1500万円以上も可能★条件合う方全員と面接！,正社員,未経験OK！【マンション企画開発】★残業月20h以下★土日休み 正社員
株式会社アイエスエフネット | ★在宅勤務OK★年休126日★平均残業7.8h★インセンMAX60％,正社員,(入社時)年収750万円⇒864万円にUP実績有【インフラエンジニア】 正社員
株式会社ティーアイピー | 有給取得率100％／完全週休二日(土日休み)／社員寮(無料)あり,正社員,★20代まで限定★スマホの通信を支える【作業スタッフ】[未]歓迎 正社員
株式会社ダイオーズジャパン | 【東証1部上場グループ】★年間休日120日以上★残業ほぼなし,正社員,オフィスを充実させる各種サービスの【提案営業】営業経験者歓迎 正社員
株式会社SEC | ★90％以上が入社時に給与UP！★即日内定、超スピード選考可能！,正社員,照らせ!技術者の未来【施工管理補助】未経験/第二新卒も人柄採用 正社員
DSP株式会社 | 入社半年で月収100万円以上の社員多数/大阪府緊急雇用対策に賛同,正社員,アニメやスポーツ番組の【反響営業】完全週休2日★学歴不問！ 正社員
日研トータルソーシング株式会社 | 【大阪府緊急雇用対策に賛同】◆年休最大160日◆残業ほぼなし,正社員,好きな街で働ける！【軽作業スタッフ】賞与2回☆定着率95％ 正社員
日研トータルソーシング株式会社 | 大阪府緊急雇用対策に賛同　★年休最大160日＋残業ほぼなし,正社員,【マシンオペレーター】★学歴・経験・職歴など一切不問！ 正社員
株式会社修優舘 | あなたの経験と能力を満足のいく給与に変えてみませんか？,正社員,＼2人に1人が年収700万円超／最新CM公開中【講師・教室運営】 正社員
株式会社アイエスエフネット | ★在宅勤務OK★完全週休2日★平均残業7.8h★インセンMAX60％,正社員,月35万～【ITエンジニア】★有給消化81％★年休126日／学歴不問 正社員
ジャパニアス株式会社 | 日本ディープラーニング協会加盟◇残業月20H程◇テレワーク約7割,正社員,AI特化チーム【AIエンジニア】基礎研究/画像解析/自然言語処理 正社員
"サングローブ株式会社 | ★創業7期目で20,000社と直取引★年休130日/土日祝休み/残業ゼロ",正社員,採用コンサル×【インサイドセールス】オフィスで年収1000万可★ 正社員
UTエイム株式会社 | 【超スピード選考】最短当日面談＆当日採用(規定有)！,正社員,【サポートスタッフ(データ管理等)】未経験歓迎※全国募集 正社員
アートバンライン株式会社 | 大手企業と多数取引で業績好調★月8～9日休み★土日休みも可,正社員,【中型(4t)トラックドライバー】面接1回★転勤なし！安定性◎ 正社員
DSP株式会社 | <大阪府緊急雇用対策に賛同>【完全週休2日】【産休育休実績有】,正社員,未経験から始める【メディアプランナー(営業)】★土日祝休み 正社員
"フジイハウス産業株式会社 | 【""三菱地所""や""住友不動産""と取引】大阪府緊急雇用対策に賛同",正社員,【設備管理スタッフ】年間休日120日／残業20h以内／賞与4ヶ月分 正社員
エフエルシープレミアム株式会社 | 【大阪府緊急雇用対策に賛同】東証二部上場企業のグループ！,正社員,【営業系総合職】★未経験8割★早期キャリアUP可能★インセン有 正社員
UTエイム株式会社 | 【東証一部上場グループ】フリーターもOK！大切なのはこれから♪,正社員,月収42万円以上可能！【清掃・洗浄スタッフ】学歴一切不問☆ 正社員
株式会社NEXER | コロナ禍でも安定成長／4拠点同時募集／オープニング募集も！,正社員,スタートアップメンバー募集！Webマーケティングの【提案営業】 正社員
UTエイム株式会社 | 【東証一部上場グループ】文系OK！キャリアチェンジも歓迎します,正社員,未経験歓迎！半導体分野の【技術系総合職(点検・検査・管理等)】 正社員
ソフトバンク営業職合同募集 | 【条件満たす方全員、電話面談確約】,正社員,ソフトバンクの【法人営業】社会人経験必須◎販売/接客経験歓迎 正社員
株式会社アイエスエフネット | ★在宅勤務OK★年休126日★平均残業7.8h★インセンMAX60％,正社員,微経験(入社時)から年276万円UP実績有【ITエンジニア】高卒以上 正社員
アートバンライン株式会社 | 大手企業と多数取引で業績好調★月8～9日休み土日休みも可,正社員,【小型(2t)トラックドライバー】★面接1回★高定着率★[未]歓迎 正社員
"洛陽交運株式会社 | ヤサカグループ／月額17,000円～即入寮できる社宅あり！",正社員,京都での新スタートを応援【タクシードライバー】年休120日以上 正社員
UTエイム株式会社 | 大阪府緊急雇用対策に賛同【東証一部上場グループ】,正社員,【製造スタッフ】未経験から高収入！月収42万円も可能※全国募集 正社員
株式会社PGSホーム | ワーク・ライフ・バランス◎残業ほぼ無し！休日出勤は一切無し！,正社員,【営業総合職】※月給40万円～(2か月間)入社祝金最大138万円支給 正社員
ジャパニアス株式会社 | 【全国に11拠点展開】◆転勤なし◆残業代100％支給◆在宅勤務有,正社員,全国募集！自社内開発【SE】★土日祝休★残業月20H★未経験OK！ 正社員
東建コーポレーション株式会社 | ＼若手限定求人／ 20代で年収100万円以上UPの先輩多数！,正社員,仕事も私生活も、贅沢に。【 営業 】全国募集/30歳迄/WEB面接OK 正社員
ソフトバンク営業職合同募集 | 【条件満たす方全員、電話面談確約】,正社員,ソフトバンクの【法人営業】未経験OK★高卒以上★35歳以下 正社員
株式会社スタッフサービス | エンジニアリング事業本部・約650種類の学習講座でスキルアップ,正社員,新型ロボット等の【ものづくりサポート】未経験OK/手当充実 正社員
朝日ソーラー株式会社 | 完全週休2日制を導入 | テレビCMも展開し知名度抜群！,正社員,"【 営業 】▼「年収1,000万円以上」も十分に目指せます！ 正社員"
株式会社 One's Will | ★月収100万円超えの営業が活躍中 ★完全週休2日 ★残業ほぼなし,正社員,アニメや映画・ケーブルテレビなどの【反響営業】★履歴書不要 正社員
株式会社アイダ設計 | 1都2府20県へエリア拡大中／テレビ・ラジオCMでもお馴染みの企業,正社員,注文住宅の【建築設計】※お客様対応に注力可能！完全週休2日 正社員
株式会社メディオテクノ | 完全週休2日｜月給25万9500円～｜インセンティブ有｜残業少なめ,正社員,定着率の高さが自慢！家電製品の【設置作業スタッフ】未経験OK 正社員
株式会社エコスマート | <11期連続増収増益>定着率92.3％／年3回長期休暇あり／未経験OK,正社員,【総合職】あなたの力で会社を上場させてみませんか？ 正社員
株式会社綜合キャリアオプション | HR×テクノロジーが強みの人材企業◆売上1010億円＆社員2000名,正社員,転職経験が武器になる！採用支援サービスの【営業】★未経験歓迎 正社員
株式会社Reazista | リリース2年で加盟店舗7万店以上！急成長企業の直販メンバー募集,契約社員,フードデリバリー＆テイクアウトアプリ『menu』の【提案営業】 契約社員
東建コーポレーション株式会社 | ◎WEB面接実施中　◎全国採用実施中（自宅近くの拠点を考慮）,正社員,これからのあなたを応援！【企画営業】※全国募集／年齢不問 正社員
アートバンライン株式会社 | 大手企業と多数取引で業績好調★売上295億円を誇る安定企業,正社員,【大型(10t)ドライバー】★面接1回★無理のない配車調整で負担少 正社員
東建コーポレーション株式会社 | ◎WEB面接実施中　◎全国採用実施中（自宅近くの拠点を考慮）,正社員,どんな経験も活かせる【企画営業】※全国募集/社会人経験者募集 正社員
アイアール株式会社 | ★完全週休2日制（土日祝） ★年間休日125日 ★超充実の福利厚生,正社員,休める！稼げる！楽しめる♪【施工管理アシスタント】★未経験OK 正社員
フォーザウィン株式会社 | ＜有休消化率100%／残業月平均15時間以下／年間休日125日＞,正社員,【インフラエンジニア】◆経験者 ◆前給以上確約 ◆面接保証 正社員
UTコンストラクション株式会社 | 【東証一部上場グループ】★オンライン面接→12月入社も可能！,正社員,食の安心安全に貢献【サービスエンジニア】★未経験歓迎/土日休 正社員
東京・日本交通株式会社 | 売上業界No.1グループ｜難波募集｜大阪府緊急雇用対策に賛同,正社員,小さなお客さまの安全を守る【キッズドライバー候補】未経験歓迎 正社員
フォーザウィン株式会社 | ＜完全週休2日／年間休日125日／有休取得100％／基本定時退社＞,正社員,あなたの第一希望、確約します。【ITエンジニア】◆前給以上保障 正社員
株式会社エー・エス・エル | 《東証一部上場企業グループ》コロナ禍でも過去最高益レベル！,正社員,【ITエンジニア／開発・インフラ】◎テレワーク率85％以上 正社員
東京・日本交通株式会社 | 売上業界No.1 日本交通グループ【大阪府緊急雇用対策に賛同】,正社員,【タクシードライバー】難波限定の募集／ミドルシニアも活躍中 正社員
UTエイム株式会社 | 【東証一部上場グループ】★WEB面接OK／スピード入社も可能,正社員,通勤しやすい♪【製造管理事務スタッフ】未経験歓迎☆全国募集 正社員
株式会社こども総合研究所 | ＜教育×IT(AI・ビッグデータ)／年休125日／残業ほぼゼロ＞,正社員,【100%自社内開発エンジニア】★前職給与以上を確約します★ 正社員
DSP株式会社 | 初年度年収450万円以上可/産休育休有/大阪府緊急雇用対策に賛同,正社員,【総合職(営業/広報/人事/総務など)】やりたいことが見つかる♪ 正社員
UTエイム株式会社 | 【東証一部上場グループ】★30～40代多数活躍中！,正社員,無理のない環境で働く！【ピッキング・仕分け】★土日休みも可能 正社員
フォーザウィン株式会社 | ＜完全週休2日／年間休日125日／有休取得100％／基本定時退社＞,正社員,【開発エンジニア】◆経験者 ◆前給以上を確約 ◆リモート案件有 正社員
株式会社ビッグモーター | 月8～10日休／賞与年2回／残業ほぼなし／転勤なし,正社員,未経験者歓迎【受付事務】★月収40万円以上目指せる ★転勤なし 正社員
株式会社そら | 『Dr.stretch』／業績好調／年4回昇給・成長できる環境が魅力！,正社員,"【ストレッチトレーナー】専門知識・経験がない方も ""大歓迎！"" 正社員"
UTエイム株式会社 | 【東証一部上場グループ】★完全週休2日制・年休190日以上も可能,正社員,【検査・実験評価スタッフ】月収42万円以上も可能！★未経験歓迎 正社員
ソフトバンク営業職合同募集 | 【条件満たす方全員、電話面談確約】,正社員,35歳以下★ソフトバンクの【法人営業】学歴不問★未経験OK 正社員
株式会社日本セレモニー | コロナ禍でも黒字経営★典礼会館やFIVESTAR WEDDINGを運営！,正社員,【セレモニープランナー】働きやすい環境＆充実の研修をご用意！ 正社員
新エネルギー計画株式会社 | ◆20～50代が活躍中◆残業ほぼゼロ ◆完全週休2日制 ◆実働7H,正社員,未経験OK！売らない【営業】コツコツ頑張れば、月収80万円も可能 正社員
UTエイム株式会社 | 【東証一部上場グループ】★安定基盤,正社員,シンプルワーク中心【軽作業スタッフ(梱包・検品等)】未経験OK！ 正社員
UTエイム株式会社 | 【東証1部上場グループの安定基盤】条件重視の方はぜひ！,正社員,月収42万円以上も可能【検品検査スタッフ】未経験歓迎！転勤なし 正社員
株式会社ワールドコーポレーション | 大阪府緊急雇用対策に賛同,正社員,同期入社多数！【資材管理】★研修充実！※全国募集※未経験歓迎 正社員
日研トータルソーシング株式会社 | ≪1年目から年収500万円以上≫入社後2年間半年ごとの昇給あり★,正社員,入社特典60万円&寮無料★トヨタ車の【製造サポート】未経験OK！ 正社員
住友不動産株式会社 | 【東証一部上場】★転勤なし ★3割が年収800万以上！,正社員,未経験から家づくりのプロに！【注文住宅営業】◆平均年収740万 正社員
株式会社ワールドコーポレーション,正社員,【管理業務スタッフ】※首都圏限定※未経験歓迎 正社員
住友不動産株式会社 | 【東証一部上場】★全領域で業界トップクラス！平均年収710万円,正社員,業界トップクラスの【技術職スタッフ（建築スペシャリスト）】 正社員
東京エムケイ株式会社 | 年収1000万円も夢ではありません！/男性育休実績あり,正社員,【グランドパイロット】※高卒以上 ★タクシー月収実績81.3万円 正社員
東京エムケイ株式会社 | 月収実績:タクシー81.3万円★男性の育休/時短勤務実績あり,正社員,＼学歴不問／【タクシードライバー】★有給休暇取得80％以上 正社員
株式会社レシックス | 【創業30年以上の安定企業／全国へ事業拡大！】,正社員,【不動産営業】最高年収5850万円、最高月収1273万円。 正社員
株式会社ＫＯＧＡＯ | ★芸能人も多数来店 ★メディアで話題のSpeed小顔,正社員,【店舗スタッフ(受付等)】★原則定時退社 ★即月給30万円も可能 正社員
株式会社来来亭 | 好きな場所で年収1000万円超の店長へ｜20～30代活躍中,正社員,【店長候補】前職より給与UPした先輩多数／未経験から独立可能！ 正社員
クレストジャパン株式会社 | ★経験者採用★年収1000万以上目指す人、必見の求人です！,正社員,"""稼ぎたい""その想いに高歩合率で応えます【不動産仲介・仕入れ】 正社員"
株式会社インテリックス | 【東証一部上場】★収入2倍UPの先輩多数★年収2000万円以上も可,正社員,【法人営業】★BtoBだから完休2日&残業20h以内★フレックス勤務 正社員
株式会社リンクスタッフグループ | ■年休120日以上 ■未経験OK ■体育会系出身の先輩が多数在籍,正社員,【人材コーディネーター】★給与＋インセンで稼げる★若手活躍中 正社員
株式会社窪治組 | ★転勤なし★社員寮完備★残業ほぼなし★実働7.5h★各種手当充実,正社員,【総合職(技術者/ドライバー/資材の搬入等)】★未経験者歓迎 正社員
株式会社サニックス | ◆東証一部上場企業 ◆初任地は希望勤務地を確約／年間休日115日,正社員,東証一部上場企業で働く【営業】★安心できる給与体系！ 正社員
株式会社アイム・ユニバース | 東京ヤクルトスワローズ公式スポンサー/借上社宅有/年休120日超,正社員,★沖縄支社募集【営業スタッフ(仕入れ・住宅営業)】※若手活躍中 正社員
株式会社ガリレオコーポレーション | ☆★週休2日制&年間休日117日で、プライベートも充実★☆,正社員,"シッカリ稼ごう！年収1,000万円もめざせる【営業】※年齢不問 正社員"
株式会社ハウスコミュニケーション | 《関西トップクラスの店舗数》★東京採用は月給30万円以上！,正社員,先輩の最高月収480万円★東京進出のコアメンバー【不動産営業】 正社員
株式会社ディードライブ | インセンティブあり／決算賞与あり／大阪府緊急雇用対策に賛同,正社員,5年で大企業を創る【提案営業】未経験OK/月給25万円～/社宅完備 正社員
"泉北ホーム株式会社 | コロナ禍でも業績好調&過去最高実績！「年収1,000万円」も可能",正社員,ワークライフバランス抜群の【営業】※入社3ヶ月月給30～35万円 正社員
株式会社VRST | ☆犬猫のいる会社☆まさかの独立支援制度☆IT×保護犬猫事業展開,正社員,【ITエンジニア】★経験者は年収800万円以上も可★副業推奨 正社員
日本交通埼玉株式会社 | 業界No.1ブランド！◆未経験入社90％以上◆年収700万以上も可能,正社員,【タクシードライバー】平均月収42万★賞与年3回★100％面接保証 正社員
